{
  "schema_version": "1.0.0",
  "audit_id": "supplemental-policy-duplicate-audit-20260817",
  "inventory_id": "supplemental-official-policy-inventory-20260817",
  "inventory_sha256": "8be3b4371213786a900f15e9b29fd5c41186ffb39bfad719e029010e88bcb23d",
  "baseline": {
    "baseline_id": "719c18c5274ba51936c161fa2e75d4ef",
    "descriptors": [
      {
        "source_id": "bokjiro-central-welfare-api",
        "snapshot_id": "ffa74ef47e6048109f11bf40d1ac5e15",
        "snapshot_collected_at": "2026-08-06T00:19:03.630716+00:00",
        "snapshot_policy_count": 461,
        "database_checked_at": "2026-08-17T02:29:19.985062+00:00",
        "database_policy_count": 461
      },
      {
        "source_id": "youthcenter-api",
        "snapshot_id": "6add34f7aad9456ab0abb19175b7621c",
        "snapshot_collected_at": "2026-08-06T00:18:54.586978+00:00",
        "snapshot_policy_count": 2695,
        "database_checked_at": "2026-08-17T02:29:19.985062+00:00",
        "database_policy_count": 2698
      }
    ]
  },
  "comparison_contract": {
    "exact": [
      "approved aggregator source_id + external_id",
      "canonical public URL"
    ],
    "review_only": [
      "normalized title"
    ],
    "not_compared": [
      "XLSX collection-method text",
      "XLSX document-note text",
      "missing period/support evidence"
    ]
  },
  "summary": {
    "candidate_identity_count": 60,
    "exact_duplicate": 26,
    "review_required": 11,
    "potentially_new": 19,
    "not_assessed": 4
  },
  "decisions": [
    {
      "candidate_id": "xlsx-row-002-96ef237a57a4",
      "input_rows": [
        2
      ],
      "input_disposition": "candidate",
      "duplicate_outcome": "exact_duplicate",
      "reason_codes": [
        "aggregator_external_id_match",
        "title_conflict"
      ],
      "matched_policies": [
        {
          "source_id": "bokjiro-central-welfare-api",
          "external_id": "WLF00004661",
          "title": "청년월세 지원사업"
        }
      ]
    },
    {
      "candidate_id": "xlsx-row-003-71fc53f4606b",
      "input_rows": [
        3
      ],
      "input_disposition": "candidate",
      "duplicate_outcome": "exact_duplicate",
      "reason_codes": [
        "aggregator_external_id_match",
        "title_conflict"
      ],
      "matched_policies": [
        {
          "source_id": "bokjiro-central-welfare-api",
          "external_id": "WLF00003201",
          "title": "주거급여(맞춤형 급여)"
        }
      ]
    },
    {
      "candidate_id": "xlsx-row-004-07290460a74e",
      "input_rows": [
        4
      ],
      "input_disposition": "candidate",
      "duplicate_outcome": "potentially_new",
      "reason_codes": [
        "no_exact_id_url_or_title_match"
      ],
      "matched_policies": []
    },
    {
      "candidate_id": "xlsx-row-005-704ca3f1f595",
      "input_rows": [
        5
      ],
      "input_disposition": "candidate",
      "duplicate_outcome": "potentially_new",
      "reason_codes": [
        "no_exact_id_url_or_title_match"
      ],
      "matched_policies": []
    },
    {
      "candidate_id": "xlsx-row-006-3dc9ad4b8195",
      "input_rows": [
        6
      ],
      "input_disposition": "candidate",
      "duplicate_outcome": "exact_duplicate",
      "reason_codes": [
        "canonical_url_match"
      ],
      "matched_policies": [
        {
          "source_id": "youthcenter-api",
          "external_id": "20250903005400211618",
          "title": "전세보증금반환보증 보증료 지원"
        },
        {
          "source_id": "youthcenter-api",
          "external_id": "20260527005400113223",
          "title": "전세보증금반환보증 보증료 지원"
        }
      ]
    },
    {
      "candidate_id": "xlsx-row-007-55ad8dbfb893",
      "input_rows": [
        7
      ],
      "input_disposition": "candidate",
      "duplicate_outcome": "exact_duplicate",
      "reason_codes": [
        "aggregator_external_id_match"
      ],
      "matched_policies": [
        {
          "source_id": "bokjiro-central-welfare-api",
          "external_id": "WLF00000060",
          "title": "청년내일저축계좌"
        }
      ]
    },
    {
      "candidate_id": "xlsx-row-008-1acdfe8c2f9d",
      "input_rows": [
        8
      ],
      "input_disposition": "candidate",
      "duplicate_outcome": "review_required",
      "reason_codes": [
        "normalized_title_match_only"
      ],
      "matched_policies": [
        {
          "source_id": "bokjiro-central-welfare-api",
          "external_id": "WLF00000838",
          "title": "고용보험 미적용자 출산급여 지원"
        },
        {
          "source_id": "youthcenter-api",
          "external_id": "20250123005400110386",
          "title": "고용보험 미적용자 출산급여 지원"
        }
      ]
    },
    {
      "candidate_id": "xlsx-row-009-7db115678713",
      "input_rows": [
        9
      ],
      "input_disposition": "candidate",
      "duplicate_outcome": "exact_duplicate",
      "reason_codes": [
        "aggregator_external_id_match"
      ],
      "matched_policies": [
        {
          "source_id": "bokjiro-central-welfare-api",
          "external_id": "WLF00001175",
          "title": "자립준비청년 자립수당 지급"
        }
      ]
    },
    {
      "candidate_id": "xlsx-row-010-3462d33e6184",
      "input_rows": [
        10
      ],
      "input_disposition": "candidate",
      "duplicate_outcome": "exact_duplicate",
      "reason_codes": [
        "aggregator_external_id_match"
      ],
      "matched_policies": [
        {
          "source_id": "youthcenter-api",
          "external_id": "20250617005400110946",
          "title": "빈곤 청년에 대한 근로인센티브 확대"
        }
      ]
    },
    {
      "candidate_id": "xlsx-row-011-18be170621df",
      "input_rows": [
        11
      ],
      "input_disposition": "candidate",
      "duplicate_outcome": "exact_duplicate",
      "reason_codes": [
        "aggregator_external_id_match",
        "title_conflict"
      ],
      "matched_policies": [
        {
          "source_id": "bokjiro-central-welfare-api",
          "external_id": "WLF00001068",
          "title": "한부모가족 아동양육비 지원"
        }
      ]
    },
    {
      "candidate_id": "xlsx-row-012-1c61630eb082",
      "input_rows": [
        12
      ],
      "input_disposition": "candidate",
      "duplicate_outcome": "exact_duplicate",
      "reason_codes": [
        "aggregator_external_id_match"
      ],
      "matched_policies": [
        {
          "source_id": "bokjiro-central-welfare-api",
          "external_id": "WLF00005567",
          "title": "정신건강 심리상담 바우처사업"
        }
      ]
    },
    {
      "candidate_id": "xlsx-row-013-481148a890e3",
      "input_rows": [
        13
      ],
      "input_disposition": "data_error",
      "duplicate_outcome": "exact_duplicate",
      "reason_codes": [
        "aggregator_external_id_match",
        "title_conflict"
      ],
      "matched_policies": [
        {
          "source_id": "bokjiro-central-welfare-api",
          "external_id": "WLF00005567",
          "title": "정신건강 심리상담 바우처사업"
        }
      ]
    },
    {
      "candidate_id": "xlsx-row-014-6ef8a04a0463",
      "input_rows": [
        14
      ],
      "input_disposition": "candidate",
      "duplicate_outcome": "potentially_new",
      "reason_codes": [
        "no_exact_id_url_or_title_match"
      ],
      "matched_policies": []
    },
    {
      "candidate_id": "xlsx-row-015-64777b1ebd8c",
      "input_rows": [
        15
      ],
      "input_disposition": "candidate",
      "duplicate_outcome": "exact_duplicate",
      "reason_codes": [
        "canonical_url_match"
      ],
      "matched_policies": [
        {
          "source_id": "youthcenter-api",
          "external_id": "20260716005400113260",
          "title": "청년일자리도약장려금"
        }
      ]
    },
    {
      "candidate_id": "xlsx-row-016-0c73f44ac3f4",
      "input_rows": [
        16
      ],
      "input_disposition": "data_error",
      "duplicate_outcome": "not_assessed",
      "reason_codes": [
        "data_error"
      ],
      "matched_policies": []
    },
    {
      "candidate_id": "xlsx-row-017-d3c5388fbf6b",
      "input_rows": [
        17
      ],
      "input_disposition": "discovery_reference",
      "duplicate_outcome": "not_assessed",
      "reason_codes": [
        "discovery_reference"
      ],
      "matched_policies": []
    },
    {
      "candidate_id": "xlsx-row-018-c20d589eac7a",
      "input_rows": [
        18
      ],
      "input_disposition": "candidate",
      "duplicate_outcome": "exact_duplicate",
      "reason_codes": [
        "canonical_url_match"
      ],
      "matched_policies": [
        {
          "source_id": "youthcenter-api",
          "external_id": "20260714005400113258",
          "title": "k-뉴딜 아카데미"
        }
      ]
    },
    {
      "candidate_id": "xlsx-row-019-ea29840eb663",
      "input_rows": [
        19
      ],
      "input_disposition": "candidate",
      "duplicate_outcome": "exact_duplicate",
      "reason_codes": [
        "canonical_url_match"
      ],
      "matched_policies": [
        {
          "source_id": "youthcenter-api",
          "external_id": "20260625005400113245",
          "title": "사회연대경제 청년일경험"
        }
      ]
    },
    {
      "candidate_id": "xlsx-row-020-a6d483776f0a",
      "input_rows": [
        20
      ],
      "input_disposition": "candidate",
      "duplicate_outcome": "potentially_new",
      "reason_codes": [
        "no_exact_id_url_or_title_match"
      ],
      "matched_policies": []
    },
    {
      "candidate_id": "xlsx-row-021-ed64c31f3be3",
      "input_rows": [
        21
      ],
      "input_disposition": "candidate",
      "duplicate_outcome": "potentially_new",
      "reason_codes": [
        "no_exact_id_url_or_title_match"
      ],
      "matched_policies": []
    },
    {
      "candidate_id": "xlsx-row-022-6e9df5abbd76",
      "input_rows": [
        22
      ],
      "input_disposition": "candidate",
      "duplicate_outcome": "potentially_new",
      "reason_codes": [
        "no_exact_id_url_or_title_match"